{
  "projectionSpecID": "example",
  "dimensions": [
    {
      "dimensionID": "b0",
      "sourcePointers": [
        {
          "pointer": "/system/state",
          "tokens": [],
          "pointsToMissing": true,
          "pointsToNull": true
        }
      ],
      "mappingRule": "example",
      "evidence": [
        {}
      ],
      "diagnosticReference": {
        "diagnosticID": "example",
        "chainRootReference": "example",
        "diagnosticKind": "STATE_VALIDITY",
        "ruleReferences": [
          {
            "ruleID": "ASH-STATE-VALIDITY-001",
            "sourceReference": "example",
            "ruleFamily": "example"
          }
        ]
      }
    },
    {
      "dimensionID": "b0",
      "sourcePointers": [
        {
          "pointer": "/system/state",
          "tokens": [],
          "pointsToMissing": true,
          "pointsToNull": true
        }
      ],
      "mappingRule": "example",
      "evidence": [
        {}
      ],
      "diagnosticReference": {
        "diagnosticID": "example",
        "chainRootReference": "example",
        "diagnosticKind": "STATE_VALIDITY",
        "ruleReferences": [
          {
            "ruleID": "ASH-STATE-VALIDITY-001",
            "sourceReference": "example",
            "ruleFamily": "example"
          }
        ]
      }
    },
    {
      "dimensionID": "b0",
      "sourcePointers": [
        {
          "pointer": "/system/state",
          "tokens": [],
          "pointsToMissing": true,
          "pointsToNull": true
        }
      ],
      "mappingRule": "example",
      "evidence": [
        {}
      ],
      "diagnosticReference": {
        "diagnosticID": "example",
        "chainRootReference": "example",
        "diagnosticKind": "STATE_VALIDITY",
        "ruleReferences": [
          {
            "ruleID": "ASH-STATE-VALIDITY-001",
            "sourceReference": "example",
            "ruleFamily": "example"
          }
        ]
      }
    },
    {
      "dimensionID": "b0",
      "sourcePointers": [
        {
          "pointer": "/system/state",
          "tokens": [],
          "pointsToMissing": true,
          "pointsToNull": true
        }
      ],
      "mappingRule": "example",
      "evidence": [
        {}
      ],
      "diagnosticReference": {
        "diagnosticID": "example",
        "chainRootReference": "example",
        "diagnosticKind": "STATE_VALIDITY",
        "ruleReferences": [
          {
            "ruleID": "ASH-STATE-VALIDITY-001",
            "sourceReference": "example",
            "ruleFamily": "example"
          }
        ]
      }
    },
    {
      "dimensionID": "b0",
      "sourcePointers": [
        {
          "pointer": "/system/state",
          "tokens": [],
          "pointsToMissing": true,
          "pointsToNull": true
        }
      ],
      "mappingRule": "example",
      "evidence": [
        {}
      ],
      "diagnosticReference": {
        "diagnosticID": "example",
        "chainRootReference": "example",
        "diagnosticKind": "STATE_VALIDITY",
        "ruleReferences": [
          {
            "ruleID": "ASH-STATE-VALIDITY-001",
            "sourceReference": "example",
            "ruleFamily": "example"
          }
        ]
      }
    },
    {
      "dimensionID": "b0",
      "sourcePointers": [
        {
          "pointer": "/system/state",
          "tokens": [],
          "pointsToMissing": true,
          "pointsToNull": true
        }
      ],
      "mappingRule": "example",
      "evidence": [
        {}
      ],
      "diagnosticReference": {
        "diagnosticID": "example",
        "chainRootReference": "example",
        "diagnosticKind": "STATE_VALIDITY",
        "ruleReferences": [
          {
            "ruleID": "ASH-STATE-VALIDITY-001",
            "sourceReference": "example",
            "ruleFamily": "example"
          }
        ]
      }
    },
    {
      "dimensionID": "b0",
      "sourcePointers": [
        {
          "pointer": "/system/state",
          "tokens": [],
          "pointsToMissing": true,
          "pointsToNull": true
        }
      ],
      "mappingRule": "example",
      "evidence": [
        {}
      ],
      "diagnosticReference": {
        "diagnosticID": "example",
        "chainRootReference": "example",
        "diagnosticKind": "STATE_VALIDITY",
        "ruleReferences": [
          {
            "ruleID": "ASH-STATE-VALIDITY-001",
            "sourceReference": "example",
            "ruleFamily": "example"
          }
        ]
      }
    },
    {
      "dimensionID": "b0",
      "sourcePointers": [
        {
          "pointer": "/system/state",
          "tokens": [],
          "pointsToMissing": true,
          "pointsToNull": true
        }
      ],
      "mappingRule": "example",
      "evidence": [
        {}
      ],
      "diagnosticReference": {
        "diagnosticID": "example",
        "chainRootReference": "example",
        "diagnosticKind": "STATE_VALIDITY",
        "ruleReferences": [
          {
            "ruleID": "ASH-STATE-VALIDITY-001",
            "sourceReference": "example",
            "ruleFamily": "example"
          }
        ]
      }
    },
    {
      "dimensionID": "b0",
      "sourcePointers": [
        {
          "pointer": "/system/state",
          "tokens": [],
          "pointsToMissing": true,
          "pointsToNull": true
        }
      ],
      "mappingRule": "example",
      "evidence": [
        {}
      ],
      "diagnosticReference": {
        "diagnosticID": "example",
        "chainRootReference": "example",
        "diagnosticKind": "STATE_VALIDITY",
        "ruleReferences": [
          {
            "ruleID": "ASH-STATE-VALIDITY-001",
            "sourceReference": "example",
            "ruleFamily": "example"
          }
        ]
      }
    }
  ],
  "version": "example",
  "sourceReferences": [
    "example"
  ]
}
